QuestionType,QuestionText,AnswerA,AnswerB,AnswerC,AnswerD,CorrectAnswer,CorrectAnswerText,CorrectAnswerInfo
multiple_choice,"Analyzing the DB mathematically to understand the data pattern and help predict future events is:","Numerical modeling","Statistical guesswork","Qualitative analysis","Predictive guesswork",A,"Numerical modeling","Analyzing a database mathematically to understand data patterns and predict future events is known as numerical modeling, which involves using mathematical algorithms and patterns for predictive analysis."
multiple_choice,"Ali would like to analyze his annual market sales record to find the month with the highest sales rate. It is better that Ali previews the data in:","Textual format","Statistical format","Graphical way","Tabular format",C,"Graphical way","Analyzing market sales records to identify the month with the highest sales rate is best done by previewing the data graphically, allowing for visual representation and easy identification of trends."
multiple_choice,"What is the correct order of steps for extracting and sorting data?","1 – The database can be sorted and retrieved using SQL queries, 2 – Data is stored in a database to add structure, 3 – Data is entered into the system for processing, 4 – Data is extracted from unstructured sources","1 – Data is stored in a database to add structure, 2 – Data is extracted from unstructured sources, 3 – The database can be sorted and retrieved using SQL queries, 4 – Data is entered into the system for processing","1 – Data is entered into the system for processing, 2 – The database can be sorted and retrieved using SQL queries, 3 – Data is stored in a database to add structure, 4 – Data is extracted from unstructured sources","1 – Data is extracted from unstructured sources, 2 – Data is entered into the system for processing, 3 – Data is stored in a database to add structure, 4 – The database can be sorted and retrieved using SQL queries",D,"1 – Data is extracted from unstructured sources, 2 – Data is entered into the system for processing, 3 – Data is stored in a database to add structure, 4 – The database can be sorted and retrieved using SQL queries","The correct sequence involves extracting data from unstructured sources, entering it into the system for processing, storing it in a database to add structure, and then sorting and retrieving it using SQL queries."
multiple_choice,"What is the purpose of storing data in a database during the data extraction process?","To add structure to the data","To reduce the size of the data","To prioritize the data","To encrypt the data",A,"To add structure to the data","Storing data in a database during the extraction process helps to add structure to the data, making it easier to sort and retrieve using SQL queries."
multiple_choice,"Which step ensures that the extracted data can be organized and queried effectively?","Data is entered into the system for processing","The database can be sorted and retrieved using SQL queries","Data is stored in a database to add structure","Data is extracted from unstructured sources",C,"Data is stored in a database to add structure","Storing the extracted data in a database to add structure ensures that it can be organized and queried effectively through SQL queries."
multiple_choice,"What is the primary implication of data threats on organizations?","Enhanced data security measures","Improved customer trust","Financial loss and damage to reputation","Decreased employee productivity",C,"Financial loss and damage to reputation","Data threats can lead to financial loss due to theft or damage of sensitive information, as well as damage to the organization's reputation."
multiple_choice,"Which of the following is a threat to data?","Accidental damage","Regular software updates","Ethical hacking","Data encryption",A,"Accidental damage","Accidental damage, such as human errors, poses a significant threat to data security and integrity."
multiple_choice,"Can a hacker be ethical?","Yes, if they use their skills for constructive purposes","No, hackers are inherently unethical","Yes, if they access systems without permission","No, ethical hacking is a contradiction",A,"Yes, if they use their skills for constructive purposes","Ethical hackers use their skills to identify vulnerabilities in systems and help organizations improve their security."
multiple_choice,"Which data protection method ensures that data can be recovered after any data loss?",Backup,Antivirus,Encryption,Firewall,A,Backup,"Backup technique ensures that data can be recovered after any data loss."
multiple_choice,"Why is it important to keep the encryption key secure?","To speed up data transmission","To protect against hardware failure","To ensure data retrievability","To prevent malware attacks",C,"To ensure data retrievability","For Encryption, you need to keep the key secure; because a lost key means that the data is not retrievable."
multiple_choice,"Which security measure protects systems from hackers?",Antivirus,Backup,Firewall,Encryption,C,Firewall,"Firewall protects systems from hackers."
multiple_choice,"What is a potential ethical issue a student may face while using the school network?","Disabling security measures to access restricted websites","Accessing unauthorized information for academic purposes","Using school resources for personal financial gain","Sharing personal login credentials with classmates",B,"Accessing unauthorized information for academic purposes","Accessing unauthorized information for academic purposes can raise ethical concerns related to academic integrity and intellectual property rights."
multiple_choice,"What is the main implication of the ever-growing demand for electronic devices?","Increased energy efficiency in device production","Reduced reliance on natural resources for device manufacturing","Increasing amounts of techno-trash","Decreased environmental impact from electronic waste",C,"Increasing amounts of techno-trash","The ever-growing demand for electronic devices leads to increasing amounts of techno-trash, contributing to environmental concerns and waste management challenges."
multiple_choice,"What is netiquette primarily concerned with?","Preventing cyber-attacks and hacking","Internet etiquette and acceptable behavior online","Regulating online content and censorship","Ensuring internet speed and connectivity",B,"Internet etiquette and acceptable behavior online","Netiquette focuses on promoting internet etiquette and guiding acceptable behavior in online interactions, emphasizing respectful and responsible communication."
multiple_choice,"What is the primary goal of a denial of service attack?","To enhance the security of the system","To steal sensitive information from the system","To improve the performance of the system","To overload the system and disrupt its normal functioning",D,"To overload the system and disrupt its normal functioning","A denial of service attack aims to overwhelm a system, making it unable to function normally."
multiple_choice,"What is the purpose of copyright in relation to movies and applications?","To promote the use of pirated movies and applications","To encourage free sharing of movies and applications","To prevent illegal download and distribution of movies and applications","To limit access to movies and applications",C,"To prevent illegal download and distribution of movies and applications","Copyright serves as a legal factor to prevent the unauthorized downloading and distribution of movies and applications."
multiple_choice,"What does a denial of service attack do to a system?","Improves the security of the system","Reduces the system's power consumption","Enhances the system's performance","Overloads the system, causing it to malfunction",D,"Overloads the system, causing it to malfunction","A denial of service attack overloads a system, leading to its malfunction and disruption of normal operations."
multiple_choice,"What is the purpose of ISO standards?","To ensure high quality products and services internationally","To regulate internet usage globally","To promote local product quality","To standardize web development practices",A,"To ensure high quality products and services internationally","ISO sets standards internationally to ensure high quality products and services."
multiple_choice,"What is the main focus of WCAG?","Standardizing web design aesthetics","Ensuring web accessibility for everyone","Regulating online content creation","Improving internet speed globally",B,"Ensuring web accessibility for everyone","WCAG is a set of rules for making the web available to everyone, focusing on web accessibility."
multiple_choice,"What is the primary purpose of W3C recommendations?","Describing best practices of web development","Regulating e-commerce platforms","Setting global trade standards","Standardizing manufacturing processes",A,"Describing best practices of web development","W3C provides international recommendations to describe the best practices of web development."
multiple_choice,"What is an example of IT outsourcing according to the text?","Microsoft Office 365","Adobe Creative Cloud",Dropbox,iCloud,D,iCloud,"IT outsourcing examples mentioned in the text include iCloud and using the services of a call center company."
multiple_choice,"What is the primary focus of Acceptable Use Policies (AUPs)?","Setting guidelines for ethical behavior online","Establishing rules for physical security measures","Defining protocols for emergency response procedures","Regulating employee attire in the workplace",A,"Setting guidelines for ethical behavior online","Acceptable Use Policies (AUPs) primarily aim to set guidelines for ethical behavior online, regulating the use of digital resources and networks within an organization."
multiple_choice,"What is an example of IT outsourcing?","Using the services of a call center company","Developing an in-house software development team","Training existing employees for IT tasks","Hiring in-house IT support staff",A,"Using the services of a call center company","IT outsourcing involves contracting out certain IT functions or services to external providers, such as call center companies."
multiple_choice,"How do Acceptable Use Policies (AUPs) vary between organizations?","They are not necessary for small organizations","They are standardized across all organizations","They are only applicable to large organizations","They differ from one organization to another",D,"They differ from one organization to another","Acceptable Use Policies (AUPs) are tailored to the specific needs, culture, and requirements of individual organizations, hence they vary from one organization to another."
multiple_choice,"What is a characteristic of Acceptable Use Policies (AUPs)?","They define acceptable behavior when using organizational resources","They are uniform across all organizations","They are primarily focused on personal internet usage","They are only applicable to IT departments",A,"They define acceptable behavior when using organizational resources","AUPs set out the acceptable and unacceptable use of technology resources within an organization, including guidelines for internet usage, email, social media, and more."
