QuestionType,QuestionText,AnswerA,AnswerB,AnswerC,AnswerD,CorrectAnswer,CorrectAnswerText,CorrectAnswerInfo
multiple_choice,"What are the stages of project IT infrastructure building?","Identification, Solution design, Development, Deployment","Initiation, Planning, Execution, Closure","Planning, Analysis, Implementation, Evaluation and improvement","Design, Testing, Deployment, Maintenance",C,"Planning, Analysis, Implementation, Evaluation and improvement","The text explicitly mentions the 4 stages as Planning, Analysis of possibilities and limitations, Implementation, and Evaluation and improvements."
multiple_choice,"Which of the following is an example of a profit-based service provider?","A supermarket","Apple manufacturer","A plumber","Governmental schools",C,"A plumber","The text provides examples of profit-based service providers including plumbers."
multiple_choice,"What is the main goal to open a business called?","Entrepreneurial vision","The business purpose","Business objective","Corporate mission",B,"The business purpose","The text explicitly states that the main goal to open a business is called 'The business purpose'."
multiple_choice,"Which department exists in most organizations and can be considered a functional area?","""Customer service""","""Marketing""","""Research and development""","""Human resources""",D,"""Human resources""","""Human resources"" is mentioned in the text as a department that exists in most organizations and can be considered a functional area."
multiple_choice,"What does a correct 'purpose' have to define for an organization?","""The organization's financial performance""","""The organization's competitors and market share""","""The organization and its goal clearly""","""The organization's history and values""",C,"""The organization and its goal clearly""","'A correct purpose' is defined in the text as one that defines the organization and states its goal clearly."
multiple_choice,"What is the main goal of opening a business called?","Business purpose","Corporate aspiration","Commercial intent","Entrepreneurial drive",A,"Business purpose","The business purpose refers to the primary objective behind establishing a business entity."
multiple_choice,"Which functional area is commonly found in a retail organization?","Sales department","Customer happiness division","Supply chain unit","Marketing bureau",A,"Sales department","The sales department is responsible for driving revenue through the sale of products or services."
multiple_choice,"Which of the following is an example of a data capture and collection device?",Tablet,Mobile,Laptop,"Barcode scanner",D,"Barcode scanner","Data capture and collection devices are used to gather information from sources such as barcodes, RFID, etc."
multiple_choice,"Which digital device is considered powerful, central, and focused?",Mobile,Server,Laptop,Tablet,B,Server,"Servers are known for their robust processing power and centralized functionality in a network environment."
multiple_choice,"What is a mandatory digital device commonly used in the retail field?","Optical mark reader","Point-of-sale system",Sensors,RFID,B,"Point-of-sale system","Point-of-sale systems are essential for processing transactions and managing inventory in retail environments."
multiple_choice,"For displaying lesson slides and videos, which digital device is recommended for a teacher?",Mobile,TV,"Wearable computer",Projector,D,Projector,"""Projector"" is recommended due to its ability to display content to a larger audience in a classroom setting."
multiple_choice,"Which input devices are commonly used for a tablet?","Touch screen and Stylus","Mouse and Keyboard","Scanner and Microphone","Trackball and Joystick",A,"Touch screen and Stylus","Touch screen and Stylus are the standard input devices for a tablet as mentioned in the text."
multiple_choice,"What is the main purpose of a Braille Embosser?","To convert text to speech","To print regular documents","To assist blind people in reading","To create 3D models",C,"To assist blind people in reading","A Braille Embosser is specifically designed to assist blind people in reading by printing documents in Braille."
multiple_choice,"'Voice screen reading' is an accessibility feature designed to support people with:","Hearing problems","Speech problems","Mobility problems","Sight problems",D,"Sight problems","'Voice screen reading' is an accessibility feature aimed at supporting individuals with sight problems by audibly reading out on-screen text."
multiple_choice,"In which industry can a 3D printer be utilized according to the text?",Retail,Hospitality,Construction,Agriculture,C,Construction,"The text suggests that a 3D printer can be used in the construction field, indicating its potential application in construction-related processes and projects."
multiple_choice,"What is the sensor's function when paired with an actuator?","It acts as a processing device","It acts as a storage device","It acts as an input device","It acts as an output device",C,"It acts as an input device","The sensor works as an input device when paired with an actuator to detect and transmit information."
multiple_choice,"What role does the actuator play when paired with a sensor?","It analyzes and processes sensor information","It provides visual representation of sensor data","It performs an action based on sensor input","It captures and stores data from the sensor",C,"It performs an action based on sensor input","The actuator's role when paired with a sensor is to perform an action based on the input received from the sensor."
multiple_choice,"Which type of operating system is best suited for managing a car parking system?","Server Multi-user OS","Mobile Single-user Single-task OS","PC Single-user Multi-task OS","Realtime OS",D,"Realtime OS","Realtime OS is specifically designed to handle real-time processes, making it suitable for time-sensitive systems like car parking management."
multiple_choice,"What is the most appropriate user interface for a PC with limited CPU speed and RAM space?","Command-line interface","Graphical User Interface","Adapted Interface","Menu-based Interface",A,"Command-line interface","A command-line interface is lightweight and requires fewer resources compared to graphical interfaces, making it suitable for systems with resource limitations."
multiple_choice,"Where does an operating system temporarily send the contents when un-allocating memory space to ensure enough space for running applications?","Cache memory","Virtual memory",RAM,"The backing store in the hard disk",D,"The backing store in the hard disk","When an OS un-allocates memory space, it temporarily sends the contents to the backing store in the hard disk to manage memory and ensure enough space for running applications."
multiple_choice,"Which utility tool can be used to organize files on a disk in a way that speeds up the performance of a system?","Partitioner utility","Traceroute utility","System profiler utility",Defragmenter,D,Defragmenter,"'Defragmenter' is a utility tool used to reorganize fragmented data on a disk, which can improve the performance of a system by reducing access time."
multiple_choice,"What should Lucy consider when sharing her images with the copy center for printing?","The file format and resolution of the images","The internet speed for uploading the images","The type of printer used by the copy center","The operating system of the copy center's computers",A,"The file format and resolution of the images","The file format and resolution of the images are crucial for ensuring high-quality prints."
multiple_choice,"What is a suggestion for Mohammed regarding his decision to use the Command-line interface instead of the Graphical user interface?","Upgrade to a computer with more resources","Switch to a different operating system","Consider using GUI for tasks that require visual interaction","Continue using Command-line interface for all tasks",C,"Consider using GUI for tasks that require visual interaction","GUI can be more user-friendly, especially for those with limited experience in using a PC."
multiple_choice,"What is the utility tool that can help Ahmed make a voice call over the internet successfully, considering his limited speed internet connection?","Firewall software",Codec,"VPN (Virtual Private Network) service","Anti-virus program",B,Codec,"Quality of Service (QoS) tool can prioritize voice traffic over the internet, ensuring a better call quality despite limited speed."
multiple_choice,"(tracert 'ip') is a command used on the (cmd) to:","Create a new directory in the file system","Display the list of installed programs","Check the available memory on the system","Trace the route of data being transmitted over the network",D,"Trace the route of data being transmitted over the network","(tracert 'ip') command is specifically used to trace the route of data being transmitted over the network."
multiple_choice,"What file type would you recommend for Hasan to save his edited video, considering he wants to upload it on Instagram?",.MOV,.MP4,.AVI,.GIF,B,.MP4,".MP4 files are commonly used for online video sharing due to their compression and quality."
multiple_choice,"What does 'Lossy compression' refer to?","The compression technique used in PNG image files","The compression which allows restoring the file quality when decompressed","The compression which reduces the file size by losing some of its quality permanently","The compression technique used in MP3 audio files",C,"The compression which reduces the file size by losing some of its quality permanently","'Lossy compression' reduces file size by permanently losing some quality, often used in audio and image files."
multiple_choice,"What does 'Lossless compression' allow?","The permanent reduction of file size by losing some quality","The restoration of file quality when decompressed without any loss","The compression technique used in JPG image files","The compression technique used in MP4 video files",B,"The restoration of file quality when decompressed without any loss","'Lossless compression' allows restoring the original quality when decompressed, commonly used in PNG image files."
multiple_choice,"What is 'Virtual Memory' in memory management?","A type of cache memory used to improve system performance","A memory space on the hard disk used to temporarily store active files when RAM is full","The allocation of memory for virtual machines","The memory reserved for virtual reality applications",B,"A memory space on the hard disk used to temporarily store active files when RAM is full","Virtual Memory is a memory space on the hard disk used to temporarily store active files when RAM is full."
multiple_choice,"What is a characteristic of open-source software as compared to proprietary software?","No initial cost, but requires paid updates","Limited features but lower long-term expenses","High initial cost, but maintenance is also charged","Free or low initial cost, but may incur maintenance expenses",D,"Free or low initial cost, but may incur maintenance expenses","This highlights the common misunderstanding that open-source software is entirely free without any potential long-term costs."
multiple_choice,"What is the purpose of compression as a tool?","Encrypting files for security purposes","Decreasing file/data size by sacrificing quality","Organizing files into a more compact structure","Increasing file/data size to improve quality",B,"Decreasing file/data size by sacrificing quality","Compression aims to reduce the size of files or data, often leading to a trade-off with quality."
multiple_choice,"Which type of cable is known for requiring specialist skills to install?","Fiber optic","Twisted pair",Cat5,Coaxial,A,"Fiber optic","Fiber optic cables require specialist skills to install due to their delicate nature and the need for precision in handling."
multiple_choice,"Which peripheral guided connection type is primarily used for connecting peripherals in close proximity?",HDMI,Bluetooth,USB,VGA,C,USB,"USB connections are typically used to connect peripherals that are in close proximity to each other, such as a mouse, keyboard, or printer to a computer."
multiple_choice,"""Satellite Broadband"" is the best selection as a connection method for which type of areas?","Urban areas with high service coverage","(Suburban areas with moderate service coverage)","(Rural areas with no service coverage)","(Coastal areas with intermittent service coverage)",C,"(Rural areas with no service coverage)","""Satellite Broadband"" is particularly suitable for rural remote areas with no internet service coverage by traditional providers, making it the best selection for such areas."
multiple_choice,"What is the main purpose of a Bridge in a network?","To connect different types of networks","To extend the coverage range of Wi-Fi signal","To encrypt data transmission for security","To direct data correctly and reduce network traffic",D,"To direct data correctly and reduce network traffic","A Bridge is used to connect two different types of networks and direct data correctly to reduce network traffic."
multiple_choice,"Which device can combine the functionality of a Hub, Firewall, and Bridge?",Switch,Router,"Access Point",Repeater,A,Switch,"A Switch can combine the functionality of a Hub, Firewall, and Bridge, allowing for efficient data transmission and network management."
multiple_choice,"What is the correct combination of devices that can form a PAN?","Mobile phone, Air Pod, Laptop, Smartwatch","Smartphone, Tablet, Desktop, Smart TV","Smartwatch, Bluetooth speaker, Digital camera, E-reader","Fitness tracker, Gaming console, Smart speaker, Smart thermostat",A,"Mobile phone, Air Pod, Laptop, Smartwatch","A Personal Area Network (PAN) can be formed by connecting devices like mobile phones, laptops, smartwatches, and Bluetooth accessories in close proximity."
multiple_choice,"What is the correct definition of WLAN?","A metropolitan area network that uses fiber optics","A personal area network that uses satellite communication","A wide area network that uses wired connections","A local area network that uses wireless service",D,"A local area network that uses wireless service","WLAN stands for Wireless Local Area Network, which is a type of local area network that uses wireless service for connecting devices within a limited area."
multiple_choice,"Which protocol is gradually being phased out and replaced with TLS?",TCP,IP,HTTP,SSL,D,SSL,"SSL (Secure Sockets Layer) is gradually being phased out and replaced with TLS (Transport Layer Security) for improved security."
multiple_choice,"Which network protocol is primarily used for voice and video calls?",HTTP,RTP,TLS,FTP,B,RTP,"H.323, SIP, and RTP are network protocols primarily used for voice and video calls."
multiple_choice,"What is the main difference between HTTP and HTTPS protocols?","Data transmission speed","Port number used","Server location restriction","Encryption technique used",D,"Encryption technique used","The main difference between HTTP and HTTPS protocols is the use of encryption techniques in HTTPS to provide a higher level of security."
multiple_choice,"Which measurement is used to quantify the speed of data transmission?",HTTPS,WinZip,Bandwidth,Latency,C,Bandwidth,"Bandwidth, measured in bits per second, quantifies the speed of data transmission over a network."
multiple_choice,"Which protocols are primarily used for voice and video calls?","H.323, SIP, and RTP","TLS and SSL","SMTP, POP3, and IMAP","HTTP, HTTPS, and FTP",A,"H.323, SIP, and RTP","H.323, SIP, and RTP are protocols primarily used for voice and video calls."
multiple_choice,"Which activities can be affected by latency in live streaming?","Downloading files and documents","Browsing web pages","Playing online games","Sending emails",C,"Playing online games","Latency can be an issue in live streaming when playing online games."
multiple_choice,"Which protocols are associated with web page access and security?","TLS and SSL","SMTP, POP3, and IMAP","H.323, SIP, and RTP","HTTP, HTTPS, and FTP",D,"HTTP, HTTPS, and FTP","HTTP, HTTPS, and FTP are protocols associated with web page access."
multiple_choice,"What is the main purpose of remote desktop technology?","To access remote desktops and provide technical support","To store files remotely","To manage cloud services","To create a virtual office environment",A,"To access remote desktops and provide technical support","Remote desktop technology is primarily used to access remote desktops and provide technical support for problem-solving."
multiple_choice,"When using iCloud, OneDrive, or Google Drive, what type of service are you actually utilizing?","File sharing services","Cloud computing","Remote desktop services","Cloud storage",D,"Cloud storage","iCloud, OneDrive, and Google Drive are examples of cloud storage services where users can store and access their files remotely."
multiple_choice,"What are two disadvantages of using cloud services?","Data loss and limited access","Limited storage space and frequent downtime","Security issues and heavy use of bandwidth","Slow data transfer and high cost",C,"Security issues and heavy use of bandwidth","Two common disadvantages of using cloud services are security issues such as data breaches, and heavy use of bandwidth which can impact network performance."
multiple_choice,"What is the recommended solution for an employee to access office files using a home laptop?","Cloud storage","Email attachment","External hard drive","Local server connection",A,"Cloud storage","Cloud storage allows convenient access to files from any location with an internet connection."
multiple_choice,"Which technology type is associated with data interrogation?","Cloud computing","Virtual reality",Smartphone,"None of the above",B,"Virtual reality","Data interrogation is associated with technologies like virtual reality."
multiple_choice,"Which type of technology is commonly linked with networking?","Digital device","Virtual reality","Cloud computing","None of the above",C,"Cloud computing","Networking is commonly associated with technologies like cloud computing."
multiple_choice,"Which emerging technology is most likely to involve a smartphone?","Data interrogation","Cloud computing","Virtual reality","None of the above",A,"Data interrogation","Smartphones are commonly associated with digital devices and data interrogation."
multiple_choice,"What is the meaning of 'Volume' in the context of data?","The importance of the data","The amount of data","The number of different types of data present","The speed at which data is entered and retrieved",B,"The amount of data","In the context of data, 'Volume' refers to the amount of data."
multiple_choice,"What does 'Veracity' refer to in the context of data?","The accuracy of the data","The number of items in a transaction","The speed at which data can be entered and retrieved","The different types of data contained",A,"The accuracy of the data","'Veracity' in the context of data refers to the accuracy of the data."
multiple_choice,"What is the implication if 'NVTC students' marks' are not being recorded in a database?","Enhanced security of student information","Difficulty in tracking students' academic progress","Improved efficiency in managing student records","No impact, as it is not essential data",B,"Difficulty in tracking students' academic progress","Not recording 'NVTC students' marks' in a database can lead to difficulty in tracking students' academic progress."
multiple_choice,"What can affect Strategic level data according to the text?","Changes in management level data","Variety in the types of data","Global or national trends","Changes in operational level data",C,"Global or national trends","'Changing markets, changes in organization or around, global or national trends' can affect Strategic level data."
multiple_choice,"What is the main characteristic of 'Operational level data'?","It contains the 5 Vs of big data","It is the initial data required to use the system","It is related to the importance of data","It is frequently updated during work",D,"It is frequently updated during work","Operational level data is defined as the frequently updated data during work, such as 'sales record.'"
multiple_choice,"What does 'Velocity' refer to in the context of Big Data?","The amount of data","Different types of data Big Data contains","How quick is the data input, analysis, and retrieve","Data accuracy",C,"How quick is the data input, analysis, and retrieve","'Velocity' in the context of Big Data refers to how quick the data input, analysis, and retrieval processes are."
multiple_choice,"What is a benefit an organization can get using online communities?","Enhanced data security measures","Guaranteed limitation of distractions for employees","Reduced need for further payment","Increased employee engagement and collaboration",D,"Increased employee engagement and collaboration","Online communities can foster increased employee engagement and collaboration, leading to improved communication and knowledge sharing."
multiple_choice,"Which type of data does the online community tool 'Vlog' focus on?","Sound clips","Text messages",Articles,Videos,D,Videos,"'Vlog' as an online community tool focuses on videos, which are a popular medium for sharing content and engaging with audiences."
multiple_choice,"What is a potential limitation of using online communities in organizations?","Enhanced data privacy","Limited distractions for employees","Potential distractions for employees","Increased employee productivity",C,"Potential distractions for employees","One potential limitation of using online communities in organizations is the possibility of causing distractions for employees, which can impact their focus and productivity."
multiple_choice,"Which of the following online communities typically allows users to collaboratively create and edit content?","Social media",Podcasts,Forums,Wiki,D,Wiki,"Wiki platforms enable collaborative content creation and editing by users."
multiple_choice,"What is the initial cost for organizations to establish an online community?","Significant setup investment","No initial cost","Subscription fee","Minimal setup fee",B,"No initial cost","Organizations do not need to pay for an online community initially."
multiple_choice,"Which of the following is an example of an online community?","Online gaming platforms","Collaborative content creation platforms","E-commerce platforms","Online banking platforms",B,"Collaborative content creation platforms","Online communities include forums, podcasts, and social media platforms where users can interact and collaborate."
multiple_choice,"What type of online platform is commonly used for discussion and information sharing?","E-commerce platforms","E-learning platforms","Online banking platforms","Social media platforms",D,"Social media platforms","Social media platforms are often used for discussions, information sharing, and connecting with a wide range of users."
multiple_choice,"Where are podcasts typically hosted and accessed?","Audio streaming platforms","E-commerce platforms","Social media platforms","Video streaming platforms",A,"Audio streaming platforms","Podcasts are audio content that are hosted and accessed through dedicated audio streaming platforms."
multiple_choice,"What is the best way to collect data quickly?",Observation,Experiment,Survey,Interview,C,Survey,"The text states that the best way to collect data quickly is through a survey."
multiple_choice,"What is the most accurate, reliable, and detailed method for collecting data?","Focus group",Observation,Interview,Experiment,A,"Focus group","According to the text, the most accurate, reliable, and detailed data can be collected using a focus group."
multiple_choice,"What should a business owner do before starting their business?","Use numerical modeling technique","Conduct trend analysis","Create a database","Collect primary data",B,"Conduct trend analysis","It is recommended in the text that a business owner should conduct trend analysis before starting their business."
multiple_choice,"What is recommended to predict future events like the weather?","Graphical data presenting as charts","Trend analysis","Numerical modelling technique","Focus group discussion",C,"Numerical modelling technique","""Numerical modelling technique"" is recommended in the text for predicting future events like the weather."
multiple_choice,"What could happen if weather stations are not recording the temperature data accurately?","Improved accuracy in weather forecasts","Misleading weather forecasts and predictions","No impact on weather forecasts","Increased likelihood of extreme weather events",B,"Misleading weather forecasts and predictions","Inaccurate temperature data from weather stations can lead to misleading weather forecasts and predictions, impacting various sectors such as agriculture, transportation, and disaster preparedness."
multiple_choice,"In terms of HONESTY, the survey can be good and bad as a data collection method.","It always ensures truthful responses","It is the most reliable method for data collection","It can provide authentic insights but is susceptible to bias and dishonest responses","It is prone to errors but eliminates bias",C,"It can provide authentic insights but is susceptible to bias and dishonest responses","Surveys can yield authentic insights but are also susceptible to bias, dishonest responses, and errors, impacting the honesty of the collected data."
